index,content,summary_gold,summary_pred
102,"1번에 대한 동맹국들의 예시와 관련 법률입니다 (우리 헌법의 베이스인 독일마저도 하고 있습니다) 미국 (USA) Espionage Act 미국의 간첩법은 특정 국가를 대상으로 국한되지 않으며, 자국의 국방, 정보, 경제적 이익을 해치는 모든 행위를 처벌. 영국 (UK) Official Secrets Act 영국의 간첩법은 적국뿐만 아니라 우방국의 간첩 활동도 포함해 국가 안보를 위협하는 모든 행위를 처벌. 프랑스 (France) Penal Code Section 411 2 프랑스는 정치, 군사, 경제 안보를 위협하는 간첩 행위를 특정 국가에 제한하지 않고 처벌. 독일 (Germany) Criminal Code Section 94 독일은 간첩 행위가 자국의 정보, 군사 또는 경제 이익을 침해할 경우 국적에 관계없이 처벌. 일본 (Japan) State Secrecy Law 일본은 국가 비밀 및 안보를 위협하는 간첩 활동을 특정 국가에 한정하지 않고 처벌. 캐나다 (Canada) Security of Information Act 캐나다는 모든 외국 정부나 단체에 의한 정보 유출 및 간첩 행위를 강력히 처벌. 호주 (Australia) Espionage and Foreign Interference Act 호주는 외국 정부 또는 단체에 의한 간첩 행위를 국가 안보 위협으로 간주하고 처벌. 이탈리아 (Italy) Penal Code Article 256 이탈리아는 자국의 안보를 위협하는 간첩 행위에 대해 외국 국적 여부에 관계없이 처벌. 스페인 (Spain) Penal Code Article 584 스페인은 군사 정보 및 국가 안보를 위협하는 모든 간첩 행위를 엄격히 처벌. 스웨덴 (Sweden) Security Act 스웨덴은 간첩 행위를 자국의 정치, 군사 또는 경제 안보를 위협하는 중범죄로 간주. 노르웨이 (Norway) Penal Code Section 121 노르웨이는 외국 정부 또는 단체의 간첩 활동에 대해 강력한 처벌 규정을 적용. 덴마크 (Denmark) Criminal Code Section 108 덴마크는 자국의 이익에 반하는 간첩 행위를 모든 외국 세력에 대해 처벌. 핀란드 (Finland) Criminal Code Chapter 12 핀란드는 국가 안보를 위협하는 간첩 행위에 대해 외국인도 동일하게 처벌. 네덜란드 (Netherlands) Criminal Code Article 98 네덜란드는 군사 및 국가 기밀을 위협하는 모든 간첩 행위를 엄격히 처벌. 벨기에 (Belgium) Criminal Code Article 113 벨기에는 국가 안보와 관련된 간첩 행위를 특정 국적에 한정하지 않고 처벌. 2번과 관련된 사건입니다 2012년 A사 영업비밀 유출 직원이 UN 입찰 관련 영업비밀을 중국에 유출 산업기술보호법 적용, 징역형 선고. 2013년 스테인리스 와이어 기술 유출 미국 공장장이 중국 경쟁업체로 기술 유출 영업비밀보호법 적용, 징역형 선고. 2015년 현대 기아차 설계도면 유출 직원이 자동차 설계도를 중국 업체에 유출 산업기술보호법 적용, 집행유예. 2016년 자동차 엔진 기술 유출 국내 기업의 엔진 기술이 중국에 유출 산업기술보호법 적용, 경미한 처벌. 2019년 반도체 기술 유출 국내 반도체 공정 기술이 중국으로 유출 산업기술보호법 적용, 징역형 선고. 2019년 LG SK 배터리 기술 분쟁 배터리 기술 유출 문제로 ITC 소송 형사처벌 없이 민사분쟁으로 해결. 2021년 2차전지 기술 유출 연구원이 핵심 배터리 기술을 해외에 유출 시도 영업비밀보호법 적용, 징역형 선고. 2024년 KF 21 전투기 기술 유출 시도 인도네시아 기술자가 KF 21 관련 정보를 유출하려다 적발 산업기술보호법 적용, 경미한 처벌. 위의 모든 것들이 대한민국 국민이고, 우리 나라가 잘 먹고 잘 살기를 바란다면 간첩법 확대를 꼭 부탁드립니다","2021년 2차전지 기술 유출 연구원이 핵심 배터리 기술을 해외에 유출 시도 영업비밀보호법 적용, 징역형 선고.","독일 (USA) Espionage Act 미국의 간첩법은 특정 국가를 대상으로 국한되지 않으며, 자국의 국방, 정보, 경제적 이익을 해치는 모든 행위를 처벌할 수 있도록 법령 해석을 강화. 영국 (Japan) State Secrets Act 영국의 간첩"
103,"안녕하세요. 저는 대한민국 국민으로서, 국민 세금으로 지급되는 국가대표 운동선수 경기력향상연구연금(일명 체육연금)의 공정성과 도덕성을 높이기 위해 이 청원을 제출합니다. 1998년 방콕 아시안게임 접영 200m에서 금메달을 획득한 전 국가대표 선수는, 국가에 기여한 공로로 인해 현재 경기력향상연구연금을 수령 중인 것으로 알려져 있습니다. 하지만 최근 전 선수가 5.18 민주화운동과 관련하여 공개적으로 역사적 사실을 부정하거나, 희생자와 유가족의 명예를 훼손하는 발언을 한 사실이 확인되었으며 이는 언론과 사회관계망서비스(SNS)를 통해 광범위하게 퍼져 사회적 물의를 빚고 있습니다. 5.18 민주화운동은 헌법 전문에도 명시된 대한민국 민주주의의 상징적 역사로서, 이를 폄훼하는 언행은 단순한 의견 표현을 넘어 헌법정신에 대한 정면 도전이며, 국가의 명예를 심각히 훼손하는 행위입니다. 국가대표로서 국민의 세금으로 혜택을 받아온 인물이 이와 같은 행동을 했다는 것은, 체육인의 공공성과 도덕성을 심각하게 훼손한 것이라 판단됩니다. 이에 따라 전 국가대표의 경기력향상연구연금 수령 자격을 철회하고, 향후 이와 유사한 사안에 대해서도 엄정한 기준을 적용할 수 있도록 제도 개선을 요청드립니다. 국민의 세금은 국민을 위한 가치에 부합하게 사용되어야 하며, 국가의 이름으로 영예를 얻은 이들에게는 그에 걸맞은 품위와 책임이 요구됩니다. 부디 이 청원이 공론화되어, 더 나은 제도적 기준과 공정한 체육행정이 마련되기를 바랍니다. 감사합니다.","이에 따라 전 국가대표의 경기력향상연구연금 수령 자격을 철회하고, 향후 이와 유사한 사안에 대해서도 엄정한 기준을 적용할 수 있도록 제도 개선을 요청드립니다.","이에 따라 전 국가대표의 경기력향상연구연금 수령 자격을 철회하고, 향후 이와 유사한 사안에 대해서도 엄정한 기준을 적용할 수 있도록 제도 개선을 요청드립니다.치료 기여할하려면하세요폭력 재판부는하실행위질환"
104,"1. 현황 제주 oo중학교, 전북 M초, 울산 A초 등 최근 악성민원으로 인해 교육이 불가능한 학교들이 늘어나고 있음 학부모에게도 민원을 제기할 권리가 있지만, 문제는 악성민원으로 인해 학생들의 학습권까지도 침해되고 있는 심각한 상황이 발생. 무고한 아동학대신고 등의 악성민원으로 교사 뿐만 아니라 다수의 학생이 고통을 받아도 악성민원인을 제지할 방법이 없음. 악성민원인들에 대한 교권보호위원회가 열리고, 특별교육 및 심리치료 조치가 내려지고 있지만 이행하지 않아도 제재나 불이익이 없음. 교육청의 통합민원대응시스템, 학교민원대응시스템도 절차와 규정은 있으나, 막무가내 악성민원인 앞에서는 무용지물인 상황 악성민원을 제지할 수 있는 법과 제도 필요 무고성 아동학대 신고를 반복하면 교사는 계속해서 조사를 받아야 하고, 이 상황에서 교사는 병가나 휴직을 선택할 수밖에 없음. 담임교사가 사라진 교실에는 학생들만 남게 됨. 심각한 학습권 침해 발생 악성민원인에 대한 형사고발을 교육청에 요구하고 있으나, 교육청은 검토 중이라는 형식적인 답변만 반복하며 책임을 회피하고 있음 학교에서 일어난 일로 인한 송사를 교사 개인이 감당하지 않도록, 악성민원인에 대한 교육청 의무고발 등 교육당국의 책무성을 강화해야 함. 언론보도을 통해 학교 악성민원과 관련하여 전국의 교사들이 주목하고 있으며, 이 사안의 결과가 교육활동을 보호하기 위한 국회와 교육당국의 의지를 보여주는 핵심적 역할을 할 것임. 9월 4일 악성민원인 처벌! 교권보호법 개정을 위한 범시민대회(전주) 에 1천 여명이 넘는 교사 및 학부모가 참여함. 최근 서이초 책임자 진상규명 청원이 5일만에 5만 달성 학교 악성민원 문제 해결에 대한 교사들의 관심과 요구가 여전히 매우 높은 상황 2. 요구내용 범죄행위에 해당하는 악성 민원의 경우 교육청 의무 고발 교권보호위원회 조치 결정 시 교육활동 침해 조치 사항(서면사과, 특별교육, 심리치료 등)의 이행 기한, 방법을 구체적으로 명시하여 기한 내 반드시 이행하도록 강제 교권보호위원회 결과 조치 사항 위반시 과태료 인상 (300만 원 1,000만 원) 악성 민원에 대한 규정 제정 및 악성민원인에게 과태료 부과 교육활동 침해행위에 목적이 정당하지 않은 신고, 고소, 고발, 허위제보 및 손해배상 청구 추가 정서적 아동학대에서 아동학대범죄 행위자를 양육자 친권자로 한정 무고성 보복성 아동학대 신고자에 대한 제재와 처벌 명시","요구내용 범죄행위에 해당하는 악성 민원의 경우 교육청 의무 고발 교권보호위원회 조치 결정 시 교육활동 침해 조치 사항(서면사과, 특별교육, 심리치료 등)의 이행 기한, 방법을 구체적으로 명시하여 기한 내 반드시 이행하도록 강제 교권보호위원회 결과 조치 사항 위반시 과태료 인상 (300만 원 1,000만 원) 악성 민원에 대한 규정 제정 및 악성민원인에게 과태료 부과 교육활동 침해행위에 목적이 정당하지 않은 신고, 고소, 고발, 허위제보 및 손해배상 청구 추가 정서적 아동학대에서 아동학대범죄 행위자를 양육자 친권자로 한정 무고성 보복성 아동학대 신고자에 대한 제재와 처벌 명시.","요구내용 범죄행위에 해당하는 악성 민원의 경우 교육청 의무 고발 교권보호위원회 조치 결정 시 교육활동 침해 조치 사항(서면사과, 특별교육, 심리치료 등)의 이행 기한, 방법을 구체적으로 명시하여 기한 내 반드시 이행하도록 강제 교권 보호위원회 결과 조치 사항 위반"
105,"대한민국의 주권과 국민의 생존권을 위협하는 E 7 4, E 74R, F 3 비자 정책을 즉각 폐지할 것을 강력히 촉구한다. 해당 정책은 단순한 이민정책이 아니라 대한민국의 국가 정체성을 심각하게 훼손하고, 한국인을 소수화하는 위험한 시도이다. 정부가 이를 철회하지 않을 경우 강력한 국민적 저항에 직면할 것임을 엄중히 경고한다. 1. E 7 4 및 E 74R 비자는 국가 주권을 포기하는 반국가적 정책이다 정부는 기존에 숙련 노동자에게 제한적으로 허용되던 E 7 4 비자를 비숙련 노동자까지 확대하여, 한국 노동시장을 붕괴 위기로 몰아넣고 있다. E 74R 비자는 사실상 영주권을 부여하는 것과 다름없는 정책으로, 대한민국을 외국인의 정착지로 만들고 있다. 이는 단순한 비자 정책이 아니라, 외국인의 장기 체류 및 정착을 합법화하여 대한민국의 국민 주권을 훼손하는 행위이다. 또한, 외국인에게 복지 혜택이 제공될 경우 그 부담은 전적으로 대한민국 국민이 떠안게 되며, 이는 명백한 국민 역차별이다. 국가의 주인은 대한민국 국민이며, 외국인을 위한 정책을 앞세워 국민을 희생시키는 행위는 절대 용납될 수 없다. 2. F 3 비자(가족 동반) 확대는 국민의 세금으로 외국인을 부양하는 정책이다 F 3 비자 확대 정책은 외국인 노동자의 가족까지 한국에 정착하도록 유도하는 사실상의 대규모 이민 정책이다. 이는 단순한 가족 초청이 아니라, 외국인의 집단 이주를 합법화하고 한국 사회의 부담을 가중시키는 위험한 결정이다. ?이미 외국인 노동자의 급증으로 인해 일자리 부족과 임금 하락이 심화되고 있다. ?그들의 가족까지 유입될 경우, 교육 의료 주거 복지 비용이 급증하여 국민 부담이 감당할 수 없는 수준에 이를 것이다. ?결국 대한민국 국민의 세금으로 외국인 가족을 부양하는 결과를 초래하며, 이는 국가 존립 자체를 위협하는 행위이다. 정부는 대한민국 국민을 외국인의 하위 계층으로 전락시키는 이 정책을 즉각 철회해야 한다. 3. 홍콩 위구르 사례를 교훈 삼아야 한다 ? 대한민국은 똑같이 당할 수 없다 과거 중국은 홍콩과 위구르를 통제하기 위해 대규모 이주 정책을 활용하여 인구 구성을 변화시키고 지배력을 강화했다. 현재 한국에서 시행 중인 E 7 4, E 74R, F 3 비자 정책이 홍콩 위구르 사례와 유사하다는 점에서 심각한 우려를 제기한다. ?비자를 유연하게 운영하여 외국인의 대규모 유입을 유도한다. ?장기 체류를 허용하고 영주권 취득을 용이하게 만든다. ?결국 정치 경제적 영향력을 장악하여 원주민(국민)의 권리를 약화시킨다. 정부는 이 정책이 가져올 장기적 위험을 직시해야 하며, 이를 방치하는 것은 국민에 대한 중대한 배신 행위임을 명심해야 한다. 4. 정부에 대한 강력한 요구 및 경고 대한민국 국민은 다음과 같이 정부에 강력히 요구한다. 1.E 7 4, E 74R, F 3 비자 정책을 즉각 전면 폐지하고, 기존 발급된 비자도 철저히 재검토하라. 2.국민적 동의 없이 추진된 반국가적 이민 정책을 수립한 관계자들을 철저히 색출하고, 강력한 법적 행정적 책임을 물어라. 3.향후 외국인의 무분별한 장기 체류 및 영주권 취득을 원천 차단하는 강력한 법안을 즉시 마련하라. 정부가 이 요구를 무시할 경우, 국민적 저항은 피할 수 없으며, 이 정책을 추진한 자들은 반드시 역사적 심판을 받을 것이다.","대한민국의 주권과 국민의 생존권을 위협하는 E 7 4, E 74R, F 3 비자 정책을 즉각 폐지할 것을 강력히 촉구한다.","이에 본 청원을 통해 대한민국의 주권과 국민의 생존권을 위협하는 E 7 4, E 74R, F 3 비자 정책을 즉각 폐지할 것을 강력히 촉구한다 대한민국은 똑같이 당할 수 없다 과거 중국은 홍콩과 위구르를 통제하기 위해 대규모 이주 정책을 활용하여 인구 구성을 변화시키고 지배"
106,"며칠 전 제주MBC에서 다뤘던 내용입니다. 다단계형 폰지사기, 적게는 30만원부터 많게는 억단위의 피해금이 있습니다. GM볼 이라는 사이트에서 스포츠경기 역배팅 수익구조로 홍보하며 많은 사람들을 유입, 한 달에 한 명씩 새로운 사람을 초대해야 한다는 조항을 만들어 초대한 사람 수에 따라 레벨로 수익배당율을 차별하기도 하고 사람을 초대하지 않으면 더 이상 활동을 못한다는 등의 이유로 20대부터 40 50대까지 약 7만명의 피해자가 생겨났습니다. 경기 방식은 간단했습니다. 두 팀이 경기를 하고 해당경기 마지막 스코어만 피하면 수익이 나는 구조였습니다. 예를 들어 3 0 으로 끝난 경기면 어느팀이 이기든 지든 저 스코어만 아니면 수익이 나는 그런 구조로 하루애 2 3게임씩 픽을 줍니다. 천만원 이상씩 충전금을 넣은 사람들은 하루에 2 30만원씩 수익이 생기니 안 할 이유가 없었죠. 이게 불법이라고 생각도 못합니다.. 그러다 며칠전 언론에 해당 사이트가 보도 되면서 출금하는 사람들이 많아지자 해당 사이트는 출금지연, 서버이상 등을 핑계삼아 사람들 돈을 빼주지 않았고 결국 3월 26일 수요일 7만명의 모든 보유금이 한 순간에 사라지는 일이 생깁니다. 3월26일 밤 10시 경기에 3 0 배팅을 했던 사람도 하지 않았던 사람도 모두 23시55 00시10분 사이로 배팅 시간이 바뀌고 그 경기는 3 0으로 마무리되며 7만명의 보유금이 정말 거짓말처럼 사라지게 되었습니다. 회원들은 본인이 배팅하지도 않았는데 자동으로 그 경기에 배팅이 되었다며 호소하였지만 듣지않았고 이 사태로 인해 스스로 목숨을 끊는 사람들이 많아질까 염려스럽니다. 피해금이 수백억은 족히 됩니다.. 더 늦어지기 전에 사기꾼들이 피해금을 다 쓰거나 은닉하기 전에 잡아주세요.. 부탁드립니다.",더 늦어지기 전에 사기꾼들이 피해금을 다 쓰거나 은닉하기 전에 잡아주세요..,더 늦어지기 전에 사기꾼들이 피해금을 다 쓰거나 은닉하기 전에 잡아주세요..큽다보니 기여할치료http했으면 재판부는박스대한민 선관 국제사회하다.텐츠
107,"존경하는 국민 여러분, 최근 조희대 대법원장을 탄핵하자는 움직임이 나오고 있습니다. 그러나 이는 헌법이 정한 절차와 원칙을 위배할 수 있는 매우 위험한 시도입니다. 대한민국 헌법 제65조는 공무원이 직무집행에서 헌법이나 법률을 위배했을 때 에만 탄핵이 가능하다고 규정하고 있습니다. 즉, 단순히 판결이 마음에 들지 않는다거나 정치적 이유만으로는 탄핵 할 수 없습니다. 탄핵은 국가 권력의 균형을 뒤흔드는 중대한 제도이기에, 엄격한 법적 요건이 반드시 충족되어야 합니다. 그런데 최근에는 AI 기술을 이용해 목소리를 조작하거나, 딥페이크 영상을 만들어 마치 사람이 발언한 것처럼 꾸미는 사례가 전 세계적으로 급증하고 있습니다. 짧은 음성만 있어도 진짜 같은 가짜 음성을 만들어낼 수 있는 시대입니다. 이런 상황에서, 검증되지 않은 음성 영상만으로 최고 사법기관의 수장을 탄핵하려는 것은 국민의 권리와 법치주의를 심각하게 해칠 수 있습니다. 저희는 요구합니다. 1. 어떤 증거가 제시되든 반드시 국과수 등 전문기관의 철저한 포렌식 검증을 거쳐야 합니다. 2. 검증되지 않은 음성 영상 자료에 근거한 탄핵 시도는 즉각 중단해야 합니다. 3. 국회는 정치적 계산이 아니라 헌법적 원칙과 국민의 신뢰를 우선해야 합니다.",그러나 이는 헌법이 정한 절차와 원칙을 위배할 수 있는 매우 위험한 시도입니다.,그러나 이는 헌법이 정한 절차와 원칙을 위배할 수 있는 매우 위험한 시도입니다 헌법 제65조는 공무원이 직무집행에서 헌법이나 법률을 위배했을 때 에만 탄핵이 가능하다고 규정하고 있습니다.대한민 기여할ECD 위헌치료 국제사회
108,"국회는 초 중등교육법 개정안을 발의하여 수업 중 스마트기기 사용 제한에 대한 내용을 가결하였습니다. 이로 인하여 교내 스마트기기 사용과 소지를 제한할 수 있는 근거가 마련되었으며, 학생들은 해당 법안이 시행되는 2026학년도부터 직격탄을 맞게 되었습니다. 이는 최근 스마트기기 활용 수업의 증가와 보급 정책에 배반하는 법률이며, 스마트기기의 유해성만을 인정하며 교내에서 스마트기기를 사용함으로써 얻는 이점을 배척합니다. 법안 제정 과정에서 당사자들인 학생들의 의견은 반영되지 않았습니다. 이하와 같은 이유로 수업 중 스마트기기 사용 제한 법안을 철회할 것을 요청합니다. 첫째, 교내 스마트기기 사용은 직접적인 교권 침해가 아닙니다. 이 법안이 추진된 이유 중 하나는 최근에 많이 발생한 교권 침해입니다. 최근 교권 침해 사례 중 수업 중 휴대폰을 사용한 학생에게 주의를 준 교사가 학생에게 폭행을 당하고, 학생이 교단에 누워 휴대폰을 조작한 사례가 있습니다. 그러나 이 사례들의 근본적인 원인은 교내 스마트기기 사용으로 발생하는 것이 아닌, 학생의 교사에 대한 태도에 있습니다. 만약 이러한 사례들에서 수업 중 만화책을 읽는 학생에게 주의를 준 교사가 학생에게 폭행을 당하고, 학생이 교단에 누워 수업과 관계 없는 그림을 그리고 있었다면, 이 역시 교권 침해입니다. 이러한 교권 침해를 단순히 교권 침해의 수단에 해당하는 스마트기기의 사용을 제한하는 것으로 해결한다면, 학생들은 다른 수단을 통해 교권 침해를 지속할 것입니다. 근본적인 문제를 해결하지 않는 것은 자살률을 낮추기 위해 교량에 높은 난간을 설치하는 것과 같습니다. 따라서 교권 침해를 예방하기 위해 필요한 것은 스마트기기 사용 제한이 아닌, 학생 대상 교권 존중 교육과 관련 징계 강화 등의 근본적 대책입니다. 또한 현재 스마트기기를 수거하지 않는 학교들은 수업 중 허용하지 않은 스마트기기 사용에 대한 징계가 존재하며, 법안을 시행하지 않더라도 현재의 교권과 학칙 수준에서 해결이 가능합니다. 둘째, 스마트기기를 제한하는 것은 학습권 보호를 보장하지 않습니다. 교육기본법 제3조에서의 학습권은 모든 국민이 평생에 걸쳐 학습하고, 능력과 적성에 따라 교육 받을 권리 입니다. 교내 스마트기기 사용 제한은 학생 개개인의 능력과 적성을 억압하며, 이는 학습권을 보장한다고 볼 수 없습니다. 현재 교내에서 스마트기기를 사용하는 학생은 자습 시간과 수업 외 시간에 자신의 능력과 적성에 따라 적합한 공부를 하고 있으며, 법을 통해 이를 금지한다면 학생은 획일화된 교육만을 받게 될 것이며, 교내에서 자신에게 맞는 공부를 하지 못하게 됩니다. 이 사항은 해당 법안이 수업 시간에만 사용을 금지하는 것이 아니라, 교내에서의 사용 자체를 금지하는 것에서 기인합니다. 결국 이 법안은 학생의 학습권 보호를 명목으로 하였지만, 정작 학생의 학습권 보호를 배반하는 것입니다. 이외에도 법안 시행에 따른 기존 스마트기기 보급 정책의 철회 과정에서 발생하는 경제적 문제, 학습 환경 변화에 따른 학생의 학업 성취도 저하 등의 문제가 발생하며, 이 법안을 시행함으로써 얻는 이익보다 손실이 더 클 것입니다. 따라서 이 법안의 통과를 철회하고, 학교의 장과 교원의 정당한 행위 보장을 위해 상기한 근본적 문제를 해결하는 법안을 먼저 제정할 것을 요청합니다.","따라서 이 법안의 통과를 철회하고, 학교의 장과 교원의 정당한 행위 보장을 위해 상기한 근본적 문제를 해결하는 법안을 먼저 제정할 것을 요청합니다.",이하와 같은 이유로 수업 중 스마트기기 사용 제한 법안을 철회할 것을 요청합니다. 반영된 기여할치료체계절차하시폭력다보니 발생하고질환중계하세요 위헌 의문을구는
