index,content,summary_gold,summary_pred
141,"이에, 국민의 알 권리를 보장하고 언론의 책임성을 강화하기 위해 기자 실명제 및 이력 공개 강화를 강력히 제안합니다. 구체적인 제안 내용 기사 옆 기자 정보 명시 의무화 모든 온라인 언론 기사 본문 옆 또는 상단에 기자의 실명과 사진을 명확히 명시하도록 의무화하고 기자 정보 클릭 시 상세 이력 공개 기자의 이름을 클릭하면 별도의 페이지에서 해당 기자의 상세 정보가 공개되어야 합니다. 상세 정보 내용 전문 분야 기자가 주로 다루는 취재 분야 (예 정치, 경제, 사회, 국제 등) 주요 경력 소속 언론사 및 주요 직책, 취재 경력 등 수상 이력 언론 관련 수상 경력 과거 작성 기사 목록 해당 기자가 작성한 모든 혹은 주요 기사 목록 (기간 제한 없이) 연락 가능한 이메일 주소 기사에 대한 피드백이나 문의를 위한 소통 창구 이러한 시스템은 기자의 이름과 이력이 공개되는 만큼 기자들은 기사 작성에 더욱 신중을 기하고, 사실 확인에 만전을 기하게 되어 기자에게는 책임감 강화를 독자들에게는 기사를 접할 때 기자의 전문성과 객관성을 직접 판단할 수 있게 되어 기사 내용에 대해 기자가 어떤 관점으로 기사를 지속적으로 작성해 왔는지를 파악하여 언론의 편향성을 스스로 검증할 수 있게 됩니다. 기자 실명제 및 이력 공개 강화는 우리 사회를 더욱 투명하고 책임감 있게 만드는 중요한 첫걸음이 될 긍적적 효과를 가져올 것이라고 확신합니다.","상세 정보 내용 전문 분야 기자가 주로 다루는 취재 분야 (예 정치, 경제, 사회, 국제 등) 주요 경력 소속 언론사 및 주요 직책, 취재 경력 등 수상 이력 언론 관련 수상 경력 과거 작성 기사 목록 해당 기자가 작성한 모든 혹은 주요 기사 목록 (기간 제한 없이) 연락 가능한 이메일 주소 기사에 대한 피드백이나 문의를 위한 소통 창구 이러한 시스템은 기자의 이름과 이력이 공개되는 만큼 기자들은 기사 작성에 더욱 신중을 기하고, 사실 확인에 만전을 기하게 되어 기자에게는 책임감 강화를 독자들에게는 기사를 접할 때 기자의 전문성과 객관성을 직접 판단할 수 있게 되어 기사 내용에 대해 기자가 어떤 관점으로 기사를 지속적으로 작성해 왔는지를 파악하여 언론의 편향성을 스스로 검증할 수 있게 됩니다.",구체적인 제안 내용 기사 옆 기자 정보 명시 의무화 모든 온라인 언론 기사 본문 옆 또는 상단에 기자의 실명과 사진을 명확히 명시하도록 의무화하고 기자 정보 클릭 시 상세 이력 공개 기자의 이름을 클릭하면 별도의 페이지에서 해당 기자의 상세 정보가 공개되어야 합니다. 기여할
142,"2024년 12월3일 도저히 상상할수 없었던 비상계엄이 발령되어 대한민국 군인들의 서울 침공과 헌법기관인 국회, 선거관리위원회 무력화 시도가 있었습니다. 이후 2024년 12월 14일 국회에서 탄핵소추되었고 2025년 4월 4일 헌법재판소에서 윤석열의 탄핵이 인용되었습니다. 2025년 6월 3일 새정부가 출범하기 전까지 장장 6개월간 국민들은 또다른 계엄, 또다른 내란이 발생할까 두려움에 떨었습니다. 비상계엄 발령후 국회에 의해 수시간만에 계엄 해제가 의결되었는데 왜 국민들이 6개월간 공포에 떨어야 했습니까? 그 이유는 6개월간 벌어진 국가권력기관 , 사법기관에서 벌어진 이해할수 없는 행태로 내란이 지속되고 있다 느꼈기 때문입니다. 법원에서 정상적으로 발부된 영장을 국가기관이 거부하고, 대통령 권한대행들은 당연한 임무를 하지 않았고, 법관은 구속된 내란범을 구속취소까지 하는 전대미문의 사건을 일으켰습니다. 또한 대통령후보의 낙마를 위해 대법원에서 한달도 안되서 유죄취지 파기환송을 하는 경악할만한 사건을 일으켰습니다. 다행히 새 정부가 들어섰으나 내란동조를 의심할수 있는 국가기관, 사법기관에는 내란수괴 윤석열이 직접 임명한 고위 공직자가 여전히 자리를 차지하고 있습니다. 최소한 본인들의 명예를 지키기 위해서라면 스스로 사직을 했어야 하는데 지금껏 그자리에 있는것은 언제든 내란을 다시 유발할수 있는 단초가 될수 있으며, 국민불안을 계속되게 하고, 국민 갈등을 유발하게 됩니다 역사적으로 군사쿠테타는 필연적으로 장기철권통치로 이어지게됩니다. 내란수괴 윤석열이 군대를 동원한 무력 친위쿠테타를 계획하면서 군고위장성들만 포섭할리 만무합니다. 친위쿠테타이기 때문에 사법부, 언론, 행정 각부서에 미리 포섭되거나 최소한 포섭될수 있는 정서적 유대감이 있는 자들을 요직에 임명했을것이라는것이 상식입니다. 실제로 내란수괴 윤석열의 술친구, 동창들을 대법관이나 고위 공직자에 임명한것은 언론을 통해 이미 알려져 있습니다 물론 임명된 모든 고위공직자가 내란공모세력은 아니겠지만 자신의 명예를 위해서라면 새정부 출범과 함께 스스로 사직을 하는것이 마땅합니다 그렇지 않은 경우 법에 의해 사퇴시킬수 있어야 합니다. 따라서 스스로 사직하거나 사퇴당한 고위 공직자에 대한 예우와 처분에 대한 법적 근거마련을 위해 특별법이 필요합니다 정리하면 12.3 비상계엄 내란수괴 윤석열이 임명한 장차관급 고위공직자, 사법부 대법관, 헌법재판소 재판관, 공기업 사장급 인사 등에 대한 사직 사퇴에 대한 특별법 제정을 요청합니다","따라서 스스로 사직하거나 사퇴당한 고위 공직자에 대한 예우와 처분에 대한 법적 근거마련을 위해 특별법이 필요합니다 정리하면 12.3 비상계엄 내란수괴 윤석열이 임명한 장차관급 고위공직자, 사법부 대법관, 헌법재판소 재판관, 공기업 사장급 인사 등에 대한 사직 사퇴에 대한 특별법 제정을 요청합니다.",따라서 스스로 사직하거나 사퇴당한 고위 공직자에 대한 예우와 처분에 대한 법적 근거마련을 위해 특별법이 필요합니다 정리하면 12.3 비상계엄 내란수괴 윤석열이 임명한 장차관급 고위공직자에 대한 탄핵소추되었고 2025년 4월 4일 헌법재판소에서 윤석
143,"1. 지금은 전작권을 환수할 때 가 아닙니다. 전작권 환수는 단순한 주권 문제가 아니라, 전시 시 실제 작전 능력과 생존 가능성에 직결되는 안보의 핵심 사안입니다. 현재 북한은 핵무기와 미사일을 고도화하고 있으며, 미국은 세계 여러 지역에 군사력을 분산 배치하고 있어 동북아 지역에서 즉각적이고 강력한 개입이 어려워질 위험이 있습니다. 이 상황에서 전작권 환수는 한미연합 작전의 긴밀성과 속도, 억제력까지 약화시킬 수 있습니다. 2. 한미동맹에 틈을 만들 수 있습니다. 한미연합사령부 체제는 세계적으로 유례가 없는 동맹 기반 연합작전 구조입니다. 이를 약화시키는 전작권 환수는 북한 중국 러시아에게 동맹 균열의 신호로 해석될 수 있으며, 결과적으로 도발 가능성을 키우는 오판을 유도할 수 있습니다. 한국군이 단독 지휘권을 가지게 될 경우, 미군의 정보 공유와 전략자산 투입이 과거보다 소극적이 될 가능성도 배제할 수 없습니다. 3. 국민은 전작권 환수의 실질적 위험에 대해 제대로 설명받지 못했습니다. 정부는 주권 회복 이라는 정치적 상징만 강조할 뿐, 전작권 환수가 가져올 실질적인 군사적 공백, 정보 단절, 연합작전 지휘 혼선, 미군 개입 지연 등 구체적 위험에 대해 국민에게 설명하지 않았습니다. 지금 환수되는 전작권은 단순한 종이 위의 권한이 아니라, 대한민국의 생존을 좌우할 명령권입니다. 4. 글로벌 안보위기 시대에는 동맹 강화가 우선입니다. 러시아의 우크라이나 침공, 이란 이스라엘 갈등, 중국의 군사 팽창, 그리고 북한의 핵무장 완성 등 지금 세계는 전면적인 안보위기로 접어들고 있습니다. 이럴 때일수록 우리는 동맹과의 긴밀한 통합체계 유지가 가장 강력한 억제력입니다. 지금 전작권을 환수하는 것은 한국 혼자 싸우겠다는 선언과 다름없으며, 이는 자살행위나 다름없습니다.",글로벌 안보위기 시대에는 동맹 강화가 우선입니다.,"글로벌 안보위기 시대에는 동맹 강화가 우선인 법치국가 건설과 국방개혁, 그리고 북한의 핵무장 완성 등 지금 세계는 전면적인 안보위기로 접어들고 있습니다. 기여할대한민 재판부는겠습니다. 위헌치료큽박스"
144,"안녕하세요. 저희 남편은 3년 전부터 전립선약을 복용해오고 있었습니다. 최근 급격히 상태가 악화되어 소변을 보기가 어려운 증상으로 병원을 찾았고, 수술을 받기 전에 보험 회사에 연락하여 지급요건을 충족하는지 확인을 한 후 의사의 판단에 따라 전립선 결찰술(전립선비대증 관련 수술)을 받았습니다. 보험회사에서는 만 50세 이상, IPSS 8점 이상, 전립선크기 100cc미만 3가지 경우를 충족하면 보험금 지급이 가능하다 하여 그 조건을 저희 남편은 충족하고 있다는 의사의 소견에 따라 수술을 진행하였습니다. 더하여 의사는 입원이 필요하다고 판단하였고, 수술 직후에는 극심한 통증과 함께 소변줄(소변 주머니)을 착용, 혈뇨가 계속되어 의학적으로도 입원이 꼭 필요한 상황이었음이 분명합니다. 수술 및 치료에 들어간 병원비는 총 1,550만 원이었고, 그중 약 1,500만 원에 대해 DB손해보험(구 동부화재)에 실손보험으로 보험금을 청구했습니다. 그런데 보험사에서는 수술전 지급요건을 충족하면 지급가능하다는 얘기와는 다르게 입원은 필요 없었다는 판단을 내리며 보험금 지급을 거부했습니다. 그 근거는 자사에서 지정한 제3의 자문의사 소견이라는 이유였습니다. 심지어 보험사 자체 손해사정사를 선임해 실사를 진행하겠다는 통보도 받았습니다. 하지만 저희는 입원을 병원에서 권고받았을 뿐더러 수술비의 부담으로 인해 확실하게 하고자 수술 전 보험회사에 전화하여 자격 요건이 충족하는지 확인까지 받았습니다. 자문 의사 소견에 따라 실제 환자를 치료한 의사의 판단을 무시하는 일이며 환자를 보지도 않은 자문의사의 판단만을 앞세워 보험금을 거절하는 것이 과연 정당한 일입니까? 또한 지급 요건을 충족하였음에도 자문 의사 판단을 앞세워 보험금을 지급하지 못하는 것이 맞는 일입니까? 더욱이 저희는 차상위 계층이며, 남편이 혼자 생계를 책임지고 있는 임대아파트 거주 가정입니다. 1,500만 원은 저희 같은 가정에겐 너무나 큰 돈이며, 생계를 크게 흔들 수 있는 금액입니다. 실손보험료는 해마다 인상되어 왔지만, 혹시라도 이런 일이 생길까 봐 한 번도 빠지지 않고 납부해왔습니다. 그런데 막상 실제 상황이 닥치자 보험금은 지급되지 않았고, 도리어 자문을 앞세운 정서적 압박만 주고 있습니다. 저희는 억울하고, 너무나 무력감을 느낍니다. 이에 아래와 같이 간곡히 요청드립니다 1. DB손해보험의 자문의사 제도 남용 여부에 대해 금융당국의 철저한 조사를 요청드립니다. 2. 실제 입원 사유와 치료 정황을 무시한 채 보험금을 거부한 행위에 대해 재검토 및 중재 요청 드립니다. 3. 향후 유사한 상황에서 실제 의료진의 판단이 무시되지 않도록 제도 개선을 촉구드립니다. 제발 이 억울함을 외면하지 말아주시고, 금융당국의 적극적인 개입과 구제가 이뤄지기를 부탁드립니다. 감사합니다.",향후 유사한 상황에서 실제 의료진의 판단이 무시되지 않도록 제도 개선을 촉구드립니다.,실제 입원 사유와 치료 정황을 무시한 채 보험금을 거부한 채 환자를 보지도 않은 자문의사의 판단만을 앞세워 보험금을 거절하는 일이 반복되지 않도록 제도 개선을 간곡히 요청드립니다.제 사례가 한 건도 발생하지 않도록 반드시 이에 대해 DB손해보험의 자문의사 제도
145,공정하고 정의로운 자유 대한민국의 무궁한 발전에 관심이 많은 국민으로서 청원합니다. 우리 나라는 그동안 주요 선거에 대해서 많은 의혹과 자료가 쌓여 있습니다. 그러나 공직선거법 위반 혐의가 발생해도 공소시효는 불과 6개월입니다. 그동안 사법부의 사례를 보면 중요 재판마저도 지연되는 경우가 빈번하였습니다. 공직선거법은 자유 대한민국의 핵심 가치를 수호하기 위하여 존재합니다. 그러나 해당 법안 공소시효가 불과 6개월 이라는 것은 지나치게 짧습니다. 객관적 증거로써 법적 절차가 진행되면 충분한 수사와 재판의 종결이 되도록 시효 여유가 필요합니다. 공직선거법 공소시효를 충분히 연장하는 법 개정을 강력히 촉구합니다.,공정하고 정의로운 자유 대한민국의 무궁한 발전에 관심이 많은 국민으로서 청원합니다.,공직선거법 공소시효를 충분히 연장하는 법 개정을 강력히 촉구합니다.사업자가 공소시 효를 충분히 연정을 강력하게 촉구합니다.대한민 재판부는 기여할치료겠습니다.절차ECD학원리즘하였다.했으면
146,아이가 오랜시간 지속된 괴롭힘으로 힘들어함에도 학교가 그리고 교육청이 피해학생을 보호할수 있는 제도가 학폭위밖에 없다는 것을 알게 되어 다른 방안도 모색해 보셨으면 하는 마음으로 청원을 합니다. 저희 아이는 현재 중학교3학년 재학중인 여자아이입니다. 1년전부터 몇몇의 아이들에게 요즘 아이들 말로 꼽을(괴롭힘) 먹으며 학교생활을 이어가던중 이제는 참는게 버거웠는지 현재 등교거부를 하고 많이 아픈상태입니다. 주요 괴롭힘 내용 어깨빵 치고 뒤에서 비웃기 급식시간 급식실에서 마주치면 돼지가 또 밥을먹네 이괴롭힘이 몇번되어 그이후론 아이가 급식을 먹지 않고 화장실에 있거나 다른곳에 숨어 있습니다. 돼지같은게 화장도 하고 다니네 체육시간 얼굴에 쓰레기던지기 같은반 장애학생을 시켜서 후드티에 쓰레기 넣게 하기 돼지같은게000하네 000이 교실에 들어오면 교실이 좁아 조퇴하지말고 그냥 자퇴나 해라 등등 수없이 많은 괴롭힘 언어로 한 폭력은 거의1년넘게 이곳에 적을수도 없을 만큼 많습니다. 아이도 처음엔 무시했고 그냥 지나치려 했지만 오랜시간 지속된 괴롭힘이 아이를 병들게 했던것 같습니다. 저는 학폭위를 신청하자 이야기 하였지만 아이는 담임선생님께 알리는것 조차 막았습니다. 담임선생님께 이야기 해봤자 그아이에게 주의를 주면 그아이는 더심하게 자기를 괴롭힐 것이고 몇번이고 학폭위를 열자 했지만 큰증거도 없고 이걸로 학폭위를 열어도 그아이들은 처벌도 가볍게 받고 본인은 더 괴롭힘을 당할거라고...(그전에도 다른아이이의 사례를 여러번 봐왔기 때문에)이게 사실이 아니면 좋겠지만 사실입니다. 학폭위를 신청하게 되면 같은반 아이인 경우 한교실에 있다가 한명씩 불려가 조사를 받고 신체폭력이나 갈취 이런 큰증거가 있는 학폭이 아니기때문에 서면사과 정도의 제일 낮은 결과가 나오겠지요. 그리고 그아이와 저희 아이는 같은반 교실에서 더 불편하게 있어야 하겠지요. 그걸 참아내다 아이가 이젠 더 참아볼 힘이 없었는지 많이 아프기 시작했습니다. 등교거부를 하고 매일 울고 힘들어해서 정신과를 갔더니 불안장애와 우울증이 심하다고 합니다. 다리에는 몇번이고 칼로 상처를낸 자국이 몇개나 있습니다.저의 마음은 하늘이 무너지는것 같습니다. 수없이 참아가며 아침마다 지옥에 들어가는 마음으로 학교를 들어갔을 아이를 생각하면 지금도 눈물이 납니다. 담임선생님께 사실을 알렸으나 학폭위를 열겠느냐 이런대안밖에 없고 학교위클래스에서도 위로는 커녕 제대로되지도 않는 대안학교목록몇개 그냥 조퇴하며 졸업해라 아니면 출석체크받는 정신병원에 입원하는 방법도 있다.이정도의 대안이 다였습니다. 피해학생엄마인 제가 이곳저곳 알아보며 지역에서 운영하는 심리치료센터를 알아봐야했고 대안학교도 수십통의 연락을해야 했고 담임선생님께 아이를 같은교실말고다른곳에서 학교생활을 할수없는지 물었으니 역시나 없다고 합니다. 제가 청원을 올리는 내용은 학폭위 신청시 가해학생과 피해학생을 학교안에서 즉각분리시키기 가벼운학폭이여도 학폭이 인정된다면 재발생시 벌점마일리지처럼 적립시켜 불이익받기 입니다. 아이가 학교에 알리고 학교의 보호를 받고 다시 같은일이 또 반복된다면 가해학생에게도 큰 불이익이 생긴다는걸 안다면 가해학생또한 또 그러지는 못하겠지요.,아이가 오랜시간 지속된 괴롭힘으로 힘들어함에도 학교가 그리고 교육청이 피해학생을 보호할수 있는 제도가 학폭위밖에 없다는 것을 알게 되어 다른 방안도 모색해 보셨으면 하는 마음으로 청원을 합니다.,아이가 오랜시간 지속된 괴롭힘으로 힘들어함에도 학교가 그리고 교육청이 피해학생을 보호할수 있는 제도가 학폭위밖에 없다는 것을 알게 되어 다른 방안도 모색해 보셨으면 하는 마음으로 청원을 올립니다.큽다보니질환치료학과에 다니던 아이들과
147,". 골프장의 개방적 대중화를 위한 법 제도 도입 1. 평일 비 선호 시간대에 청소년 및 고령자에게 할인된 이용 요금 제공 2. 광역지자체별 1개 이상 6 9홀 규모의 공공 골프장 설치 및 운영 3. 공공 골프장을 잔디 복합공원 형태로 조성(산책로, 카페, 캠핑장 등 포함) . 골프장 간 공정 경쟁과 균형 발전을 위한 조세 및 제도 개선 1. 현행 개별소비세의 등급별 차등제 도입(0원 7만원까지) 2. 비회원제 선정 기준의 전국 단일화 및 지역 간 차등 규제 개선 3. 대중제 골프장에 대한 세금감면에 기여도 평가요소 추가 청소년?고령자 수용 실적, 대중화 노력, 종사자 만족도, 지역 경제 활성화 기여도 등 4. 지방 대중제 골프장에 대한 레저관광 사업 인센티브 부여",비회원제 선정 기준의 전국 단일화 및 지역 간 차등 규제 개선 3.,"대중제 골프장에 대한 세금감면에 기여도 평가요소 추가 청소년?고령자 수용 실적, 대중화 노력, 종사자 만족도, 지역 경제 활성화 기여도 등 4.http 기여할I)ECD다보니 반영된 분담치료"
148,"1.청도군 및 관련 지자체 조례(소싸움 허가 및 지원)에 대한 전면 재검토 및 폐지 청도군은 현재 상설 소싸움 경기를 운영하며, 이를 위해 공공 예산이 지속적으로 투입되고 있습니다. 그러나 해당 예산의 상당 부분은 배팅 환급금으로 사용되며, 실질적인 지역 수익으로 이어지지 않는 구조입니다. 또한 배팅 이라는 형식적 외피 뒤에 불법 도박 정황까지 의심되고 있는 상황입니다. 이처럼 동물의 생명을 비윤리적으로 이용하면서도 지역 경제에 실질적 도움이 되지 않는 껍데기만 남은 전통 은 이제 재검토되어야 마땅합니다. 2.동물 보호 관점에서 민속놀이 및 지역 축제에 대한 윤리적 가이드라인 마련 모든 지역 행사 및 민속놀이는 시대 변화에 따라 새롭게 점검되어야 합니다. 생명을 대상화하거나 고통을 가하는 방식은 어떤 명분으로도 정당화될 수 없습니다. 이제는 동물 보호 를 기준으로 삼아 전통과 윤리의 균형을 맞춰야 할 때입니다. 3.소싸움에 동원된 동물 보호 및 재활 시스템 구축 현재 싸움소로 이용되는 소들은 대개 생후 50개월 내외로 투입되어 10년 이상 싸움에 이용된 뒤 도살되고 있습니다. 이는 생명에 대한 최소한의 존엄조차 지켜지지 않는, 구조적인 학대입니다. 국가는 이들 동물에 대한 보호 및 사후 재활 대책을 마련해야 하며, 이를 제도화하는 것이 시급합니다. 4.폭력 요소를 배제한 대체 민속 콘텐츠 및 지역 축제 개발 지원 지역 축제는 지역 공동체의 정체성과 경제를 연결하는 중요한 자산입니다. 그러나 그 콘텐츠가 폭력과 생명 경시 위에 기반한다면, 이는 지속 가능하지도, 모두를 포용할 수도 없습니다. 다양한 세대와 국가, 종교, 문화를 가진 사람들이 함께 즐길 수 있는, 비폭력적이고 생명친화적인 전통 콘텐츠 개발이 필요합니다. 문화 라는 이름으로 자행되는 생명 유린은 이제 멈춰야 합니다. 국회와 정부가 더 이상 외면하지 말고, 지금 이 순간부터라도 책임 있게 나서주시기를 간곡히 요청드립니다.","국회와 정부가 더 이상 외면하지 말고, 지금 이 순간부터라도 책임 있게 나서주시기를 간곡히 요청드립니다.","국회와 정부가 더 이상 외면하지 말고, 지금 이 순간부터라도 책임 있게 나서주시기를 간곡히 요청드립니다.중계됩니다. 기여할치료박스큽하세요 재판부는 발생하고하였다.http행위대한민"
