index,content,summary_gold,summary_pred
0,삼권분립 안에 속해 있는 사법부의 신뢰를 또 한번 무너졌습니다. 이재명 재판에 1심 선고에서 사진은 조작이 아니라는 판결이 있었지만 1심 판사들의 의견을 무시하고 추가적인 수사없이 사진 확대는 조작이라는 단어로 대한민국의 법의 질서를 어지럽혔습니다. 국민들은 사진 확대로 무죄가 나왔다는 황당한 판결이 무법천지로 살아가도 된다는 뜻이 아니겠습니까? 김문기와 유동규랑 골프 사진이 100% 드러났음에도 이를 조작이라고 매장하는 판사님들이 어떻게 정의구현을 하겠습니까? 정말 대한민국에 살아가는 한 사람으로서 억장이 무너집니다. 이재명은 하는 행동은 절대 국토부에게 협박을 받을 사람이 아닙니다. 정말 이 청원을 올리는 이유는 정치판사가 아닌 누구에게도 공평한 판사를 원하는 겁니다. 국민의 소망을 담아 최은정판사 이예슬판사 정재오판사를 즉각 파면시키고 수사를 했으면 합니다. 감사합니다.,정말 이 청원을 올리는 이유는 정치판사가 아닌 누구에게도 공평한 판사를 원하는 겁니다.,이재명 재판에 1심 선고에서 사진은 조작이 아니라는 판결이 있었지만 1심 판사들의 의견을 무시하고 추가적인 수사없이 사진 확대는 조작이라는 단어로 대한민국의 법의 질서를 어지럽혔습니다.ECD 기여할습니까?박스겠습니다. 통합진보당대한민
1,"이유 윤석열 전 대통령의 장기 구금은 단순한 개인의 문제가 아니라, 대한민국 법치주의의 근간을 흔드는 중대한 사안입니다. 선구속 후재판 이라는 전례 없는 조치는 법이 정치의 도구로 전락하는 위험을 보여주고 있습니다. 헌법이 보장하는 기본권과 인권의 원칙에 따라, 국회는 국민의 대표기관으로서 인도적이고 정의로운 결단을 내려야 합니다. 정치적 입장과 무관하게 인간의 생명과 존엄은 존중되어야 하며, 전직 대통령이라 하여 예외가 될 수 없습니다. 윤 전 대통령에 대한 인권 보호는 곧 대한민국이 인권국가임을 세계에 증명하는 길입니다. 국회가 국민의 뜻을 받들어 정의와 인권을 지켜주시길 간곡히 청원드립니다. 청원 내용 1 법제사법위원회와 인권위원회는 구금 환경과 건강권 침해 실태를 즉시 조사하여 국민 앞에 보고해 주십시오. 2 교정 당국은 피구속인의 치료 면회 법률대리 접근을 보장하고, 인권 보호를 위한 조치를 강화해 주십시오. 3 향후 재판 과정에서는 정치적 고려 없는 공정한 절차와 사법 정의의 회복이 이루어지도록 해 주십시오. 2025년 10월 17일 청원인 박 현 변호사 손 나 국민데일리 대표","2 교정 당국은 피구속인의 치료 면회 법률대리 접근을 보장하고, 인권 보호를 위한 조치를 강화해 주십시오.",향후 재판 과정에서는 정치적 고려 없는 공정한 절차와 사법 정의의 회복이 이루어지도록 해 주십시오.ECD 기여할치료큽박스 위헌겠습니다. 재판부는절차질환하세요보안다보니
2,"1.현행의 사전투표, 부재자 투표 금지 2. 투표함 이동 금지 투표 후 현장에서 바로 참관인 입회 하에 전면 수개표 진행(대만 투표 방식) 3.전국 모든 투표 현장의 전자 개표기 사용 중치하고 전면 수 개표로 전환 4.관리자의 날인 없는 투표 용지 무효 처리 5.부재자 투표 및 사전 투표는 서울 지역 의 특정한 우편주소지를 사전 공지하고 개표 하루 전일의 18시 우편 도착물에 한 해서만 수 기 표로 별로 진행 6.개표시 투표 용지를 머리 위로 들어 올리면서 해당 후보자의 이름을 외치고 ,참관인,집계인은 바를 자료 표기하면서 참관인이 이를 재차 확인하고 집계한다. 7.투표함 내에 개표가 끝나면 투표함 안을 바로 공개한다. 8.개표 시에 방청을 희망하는 유권자는 투표항 폴리스 라인을 설치하고 경찰관 입회 하에 참관 및 사진촬영을 허락한다 이때에 방청 자는 중앙 선관위에서 참여원을 사전에 제한 한다. 9.개표를 끝낸 해당 개표소에서는 개표 결과를 개표소 바깥 공지 창에 즉각 공지하고 개표결과서를 참관인 및 경찰관 동행 하에 중앙선관위에 인편으로 직접 전달한다. 10.중앙선거관위는 이러한 전국의 개표 진행의 집계상황을 실시간 생 중계방송을 허락한다 11. 투,개표의 모든 자료는 개표일로 부터 향후 1년 까지 보관 후 에 중앙선관위에서 폐기한다 12. 부징선거 관련자 및 투,개표 조작에 관여한 자는 무기 및 사형에 처한다로 관련법을 국혀에서 제정한다 13. 현행의 판사들 중심의 기존 중앙선관위 및 지방선관위를 전면 폐지하고, 별도의 중립성이 보장된 중앙선관위 및 지방선관위를 국회에서 법률로 제정한다 14. 중앙선관위 및 지방선관위는 국정 감사, 특검법, 감사원 감사,국정윈 조사 등을 거부할수 없다로 관련법을 제정한다.","부징선거 관련자 및 투,개표 조작에 관여한 자는 무기 및 사형에 처한다로 관련법을 국혀에서 제정한다 13.","부징선거 관련자 및 투,개표 조작에 관여한 자는 무기 및 사형에 처한다로 관련법을 국혀에서 제정한다 13. 선관위 및 지방선관위는 국정 감사, 특검법, 감사원 감사,국정윈 조사 등을 거부할수 없다로 관련"
3,"보조교사와 연장반 교사는 담임교사와 마찬가지로 아이들을 돌보고, 수업을 준비하고, 각종 행정업무를 수행합니다. 그러나 현실에서는 보조 라는 명칭 아래, 휴게시간 미보장, 정당한 수당 미지급, 조직 내 차별, 부당 해고 등의 문제가 반복되고 있습니다. 특히 일부 어린이집에서는 원장이 담임으로 등록만 하고, 보조교사에게 실질적 반 운영을 맡기거나, 장애아동을 전담하게 하면서도 정당한 수당을 지급하지 않는 등 명백한 인권 침해 및 법적 사각지대가 존재합니다. 또한 교사 개인이 행사비용, 학부모 선물비 등을 부담하게 하거나, 회식조차 차별받는 조직문화, 그리고 소문 블랙리스트 등으로 교사의 명예가 훼손되는 사례도 발생하고 있습니다. 이러한 현실은 단순한 보육 문제가 아닌 교육 노동자의 인권과 사회 정의의 문제입니다. ?? [청원 내용] 정부와 관계 당국에 다음과 같은 실질적 제도 개선을 요청합니다. ? 교사로서의 지위 인정 및 처우 개선 ? 보조 라는 호칭 대신 비담임교사 보육지원교사 등 공식 명칭 사용 ? 자격 및 경력 인정, 급여 현실화 ? 실질적인 노동 조건 보장 ? 휴게시간 제도의 현실 반영 및 근무시간 정비 ? 정교사 업무 대체 시 수당 지급 및 임금 반영 ? 장애아동 전담 시 실질 담당자에게 수당 지급 ? 기본 노동권 보장 ? 연차 사용 보장 및 대체 인력 지원 ? 급여의 지자체 직접 지급 및 지급 내역 투명화 ? 주말 공휴일 출근 강요 금지 ? 조직 내 차별 및 부당 관행 개선 ? 회식 등 조직문화 내 차별 해소 ? 부당 지시 금지 및 명확한 직무 기준 제시 ? 원장의 담임 겸직 전면 금지 및 실사 강화 ? 행사 중 단독 보육 지시 금지 및 대체 인력 확보 ? 인권 보호 및 공정한 평가 체계 확립 ? 보조교사에 대한 인식 개선 및 인권 교육 확대 ? 부당 해고 방지 위한 해고 기준 명확화 및 구제 절차 마련 ? 교사에 대한 허위사실 유포 블랙리스트 작성 금지 ? 피해자 보호 제도 및 제3기관 상담 법률 지원 체계 구축 이상과 같은 제도적 개선을 통해, 보조교사 연장반 교사도 동등한 교육자로서 존중받고, 아이들에게도 더 나은 보육 환경이 제공될 수 있기를 간절히 바랍니다. 정부와 사회가 더 이상 이들의 헌신을 당연하게 여기지 말고, 이제는 존중과 보호의 제도적 책임을 다해 주시기 바랍니다. 감사합니다. 관련 파일 첨부도 확인 부탁 드립니다.",[청원 내용] 정부와 관계 당국에 다음과 같은 실질적 제도 개선을 요청합니다.,"또한 교사 개인이 행사비용, 학부모 선물비 등을 부담하게 하거나, 회식조차 차별받는 조직문화, 그리고 소문 블랙리스트 등으로 교사의 명예가 훼손되는 사례도 발생하지 않도록 제도적 개선을 간곡히 요청합니다.폭력 기여할치료행위학원"
4,"도덕성이나 사상적으로 문제가 있거나 또는 전과가 몇번이나 있거나 아직도 사법리스크 재판 과정에 있는 사람에게 나라 정치를 맡긴다는 것은 그만큼 국가에 혼란이나 악영향을 미칠 수 있고 그런 사람들이 국민 대신해 대표하여 정치하는 것은 바람직하지 않기에 국민들은 도덕, 사상에 문제가 있거나 전과가 몇개 있거나 아직 사법 재판이 여러 있는 자들이 정치하는 것을 주권자로서 원하지도 않고 바라지도 않기에 사상에 문제가 있고 전과나 사법 재판이 여러 받고 있는 사람들이 정치한다면 그것은 국가적 시스템 혼란이나 국가적 악영향을 미치기에 주권자인 국민들은 그런 사람들로 정치인 구성이나 대선후보로 나오는 것을 원하지도 않고 그것은 여러므로 바람직하지 않기에 사상적 문제가 있고 공산주의를 찬양하거나 전과, 사법 재판이 여러 있는 사람에 한해서는 정치나 선거 못하오게 하고 대통령 후보로서도 나오지 못하게 신속히 제도할 것을 청원합니다.","도덕성이나 사상적으로 문제가 있거나 또는 전과가 몇번이나 있거나 아직도 사법리스크 재판 과정에 있는 사람에게 나라 정치를 맡긴다는 것은 그만큼 국가에 혼란이나 악영향을 미칠 수 있고 그런 사람들이 국민 대신해 대표하여 정치하는 것은 바람직하지 않기에 국민들은 도덕, 사상에 문제가 있거나 전과가 몇개 있거나 아직 사법 재판이 여러 있는 자들이 정치하는 것을 주권자로서 원하지도 않고 바라지도 않기에 사상에 문제가 있고 전과나 사법 재판이 여러 받고 있는 사람들이 정치한다면 그것은 국가적 시스템 혼란이나 국가적 악영향을 미치기에 주권자인 국민들은 그런 사람들로 정치인 구성이나 대선후보로 나오는 것을 원하지도 않고 그것은 여러므로 바람직하지 않기에 사상적 문제가 있고 공산주의를 찬양하거나 전과, 사법 재판이 여러 있는 사람에 한해서는 정치나 선거 못하오게 하고 대통령 후보로서도 나오지 못하게 신속히 제도할 것을 청원합니다.","사상적이나 사상적으로 문제가 있거나 또는 전과가 몇번이나 있거나 아직도 사법리스크 재판 과정에 있는 사람에게 나라 정치를 맡긴다는 것은 그만큼 국가에 혼란이나 악영향을 미칠 수 있고 그런 사람들이 국민 대신해 대표하여 정치하는 것은 바람직하지 않기에 국민들은 도덕, 사상에 문제가 있거나 전과가"
5,"K 팝, K 드라마, K 푸드에 열광하고 코스피 고공 행진의 축배를 들고 있지만, 우리 사회에는 아직도 이해할 수 없는 불합리한 건축 규제가 있습니다. 바로 건축법상 주택이 아니면 사람이 살 수 없고, 이를 위반할 경우 불법 거주자 및 행정 범죄자로 간주되어 스스로 나갈 때까지 이행강제금을 계속 부과할 수 있다는 것입니다. 이 법은 건축법 제79조,80조이며, 명확한 문장으로 정의되어 있지 않음에도 지자체는 이 조항을 근거로 이행강제금을 부과할 수 있다고 합니다. 다만, 지금까지 주택이 아닌 건축물에 단순히 거주한다는 이유만으로 대규모 단속을 시행한 사례는 실제로 없었습니다. 하지만 이제 10월이면 대규모 주거 단속이 현실화될 시점이 됩니다. 생활숙박시설의 주거 규제 정책으로 인해 비주택 건축물 모두가 주거 규제 대상이 되는 상황이 발생한 것입니다. 더군다나 생활숙박시설은 2021년 10월 건축법 시행령 개정을 통해 기존 건축물에 숙박업 등록 의무를 부과하고, 영업 등록을 하지 않으면 일단 주거 사용되는 것으로 의심하고 단속하겠다는 것입니다. 그러나 국민에게 영업 등록을 강제하는 법 이것이 맞을까요? 그리고 어떤 법이 주택이 아니면 거주할 수 없다고 명시되어 있나요? 심지어 레지던스(Residence) 라는 이름으로 분양되기도 하였습니다. 시행사는 거주 가능한 건축물처럼 지자체로부터 건축허가를 받았고, 대기업은 프리미엄 거주공간이라는 홍보로 분양 허가를 받았으며, 수분양자는 내집마련을 꿈꾸며 분양받고, 입주자들은 10년이상 평온하게 거주하고 있었습니다. 어떤 지자체는 주택 임대 사업자 등록을 유도하며 받았고, 전입신고는 찾아가는 민원 서비스로 제공되기도 했습니다. 심지어 거주 목적으로 사용하기 때문에 부가세 환급도 할 수 없다는 확약서를 분양 계약시 작성하기도 했습니다. 그런데 그런 곳이 하루아침에 불법 거주시설이 되었습니다. 합법적으로 살려면 용도변경을 하라고 했습니다. 기한을 정해 놓고 빨리 완료하지 않으면 단속하겠다고 협박하듯이 공문을 보내지만, 용도 변경은 건축 정책 하나만으로 해결되는 문제가 아니었습니다. 지구단위계획, 주차장법, 관광진흥법, 건설분양법 등 갈수록 고쳐야 할 법령이 속출함에도 개정은 손도 대지 못하고, 호실당 수천만 원에서 억 단위까지 되는 기부채납과 필요도 없는 주차장 건축을 강요당하고 있습니다. 수없이 호소했습니다. 삭발도 하고, 폭우가 쏟아지는 국토부 앞 길바닥에 엎드려 절하기도 했습니다. 지자체도 행정부담을 감당하기 어렵다고 하소연 했습니다. 시행사도 시공사도 온갖 소송과 금융위험에 시달리고, 화목했던 이웃과 지역사회는 불법 거주자 와 생숙 투기꾼 이라는 프레임속에서 감시와 비난으로 숨이 막힐 지경입니다. 생활숙박시설 규제를 통한 집값 안정은 용도변경이 완료된 단지들이 전혀 가격상승이 없었다는 사실로 증명되고 있습니다. 무엇을 위해 시작했든 이제는 이유가 없습니다. 폐해만 남았고 앞으로 더 커질 수도 있습니다. 형평성 이라는 프레임으로 제도개선을 회피하지 마시기 바랍니다. 우리 사회가 진짜 성장 을 하려면 효능이 없다고 증명된 불필요한 규제는 폐지되어야 합니다. 첨부된 자료도 읽어주시고, 이 문제를 어떻게 해결해야 할지 꼭 확인해주시기를 부탁드립니다. 감사합니다.",형평성 이라는 프레임으로 제도개선을 회피하지 마시기 바랍니다.,"부디 본 청원이 아파트, 오피스텔과 같은 공동주택, 지식산업센터, 소형상가 등 다양한 형태의 건축물에서 고통받는 수많은 입주자 임차인의 목소리를 대변할 수 있도록 귀 기울여 주시길 바랍니다. 재판부는 기여할 반영된큽치료"
6,"8년전에 남편이 교통사고를 당해 장애1급(거동불가,의식없는 상태)판정을 받았으며 극심한 후유장애를 겪고있는 상태입니다 그리고 올해 93세이신 시어머니를 함께 봉양하고 있는데 시어머니또한 노인성 치매와 뇌경색,부정맥,당뇨병등을 앓고 있는 상황입니다 남편은 교통사고로 뇌를 크게 다쳐서 인지기능이 없고 거동이 불가능하며, 1시간마다 석션(인공으로 가래배출)을 해야하며 뱃줄(위루관)을 통한 음식을 투여해야 생명을 유지할 수 있는 식물인간입니다 설상가상으로 시어머니는 최근에 병세가 악화되어 뇌경색으로 쓰러져 치료를 받고 있습니다. 지금은 치매와 뇌경색으로 인한 후유증으로 목욕은 물론 화장실도 혼자 가지 못하는 상황이라 한시도 눈을 뗄수 없는 상황입니다. 그래서. 저는 중증의 환자 둘을 동시에 혼자 감당하고 있는 상황입니다 제가 입법당국이나 행정당국에 청원하는 바는 현재의 보건정책제도의 아쉬움과 미비점에 대해 말씀드리고자 함입니다 건강보험공단에서는 장애인 활동보조인을 지원해주는데 지원시간이 하루 8시간에 불과하며 장애인 목욕지원이나 정작 수시로 해야하고 생명유지에 꼭 필요한 석션은 법적문제로 해줄 수 없다고 합니다 석션은 가래가 끓을때마다 비정기적으로, 수시로 해야하니 보호자가 한 시도 자리를 비울 수 없는 상황입니다 저희 남편처럼 중증장애인의 경우 24시간 케어를해도 부족한데 장애활동보조인의 8시간 지원은 너무 터무니없이 짧은 시간이며 석션등을 할 수 없기에 보조한다고해도 실질적 도움이 되지 못하는 제도라서 이용조차 할 수 없는 실정입니다 그래서 저는 남편의 교통사고후 모든 생업을 포기하고 간병에만 전념하고 있기에 경제활동을 하지 못하여 생계또한 어려운 상황입니다 그리고 생계보다 저를 더 힘들게 하는 것은 미래에 대한 희망이 없고 환자 곁을 한 시도 떠날 수 없어 시장을 보러 가는 일상적인 일조차 할 수 없기에 삶의 의욕마저 꺾이고 있는 상황입니다 저희 남편처럼 중증 와상 환자의 경우 장애활동보조인의 지원이 현실과 너무 맞지않는 것 같습니다. 제가 생각한 실질적인 도움이 될 수 있는 방법은 장애활동보조인 대신 전적으로 가족이 간병할 수 있게 해주고 대신에 경제적 지원을 더 두텁게 해주는 방법 뿐입니다 그게 불가능하다면 장애활동 보조 시간을 늘려 주시고 활동 범위을 확대 해주셨으면 좋겠습니다 한가지 더 말씀 드리자면 저희 시어머니의 경우 장기요양 3등급인데 요양보호사는 3시간을 지원해주고 가족이 간병 할 때는 1시간만 지원해준다고 합니다 물론 가족간병제도를 악용해 이익을 취하는 사례도있기 때문에 오히려 저희 같은 가정이 선의의 피해를 보고 있습니다 현행 제도는 현실과 맞지않아 전혀 도움이 되지 않습니다. 힘들더라도 가족이 간병할 때 환자들은 안정을 느끼고 보살핌을 받는다는 생각을 하게 됩니다 치유 효과 또한 좋다고 생각합니다. 물론 저와 같은 특수한 경우는 많지 않겠지만 두 환자를 동시에 케어 하는 경우 현실에 맞는 맞춤형 복지제도가 필요하다고 생각합니다. 마지막으로 다시 드리고 싶은 말씀은 저희 가족처럼 복지정책의 절실한 수요가 필요한 경우를 행정당국에서 잘 실사하시어 가족 간병에 실질적 도움이 될 수 있도록 적절한 법개정과 제도개선을 해주시면 감사하겠습니다","저는 중증의 환자 둘을 동시에 혼자 감당하고 있는 상황입니다 제가 입법당국이나 행정당국에 청원하는 바는 현재의 보건정책제도의 아쉬움과 미비점에 대해 말씀드리고자 함입니다 건강보험공단에서는 장애인 활동보조인을 지원해주는데 지원시간이 하루 8시간에 불과하며 장애인 목욕지원이나 정작 수시로 해야하고 생명유지에 꼭 필요한 석션은 법적문제로 해줄 수 없다고 합니다 석션은 가래가 끓을때마다 비정기적으로, 수시로 해야하니 보호자가 한 시도 자리를 비울 수 없는 상황입니다 저희 남편처럼 중증장애인의 경우 24시간 케어를해도 부족한데 장애활동보조인의 8시간 지원은 너무 터무니없이 짧은 시간이며 석션등을 할 수 없기에 보조한다고해도 실질적 도움이 되지 못하는 제도라서 이용조차 할 수 없는 실정입니다 그래서 저는 남편의 교통사고후 모든 생업을 포기하고 간병에만 전념하고 있기에 경제활동을 하지 못하여 생계또한 어려운 상황입니다 그리고 생계보다 저를 더 힘들게 하는 것은 미래에 대한 희망이 없고 환자 곁을 한 시도 떠날 수 없어 시장을 보러 가는 일상적인 일조차 할 수 없기에 삶의 의욕마저 꺾이고 있는 상황입니다 저희 남편처럼 중증 와상 환자의 경우 장애활동보조인의 지원이 현실과 너무 맞지않는 것 같습니다.",저는 중증의 환자 둘을 동시에 혼자 감당하고 있는 상황입니다 제가 입법당국이나 행정당국에 청원하는 바는 현재의 보건정책제도의 아쉬움과 미비점에 대해 말씀드리고자 함입니다 건강보험공단에서는 장애인 활동보조인을 지원해주는데 지원시간이 하루 8시간에 불과하며 장애인
