index,content,summary_gold,summary_pred
50,"진성준 정책위원장이 그토록 주장하는 국가세제법안 및 노란봉투법으로 국가 경제가 나락으로 가고 있습니다 계엄이란 사태에도 코스피는 불가 1.5%가량 하락 50조원 가량 증발했지만 이번 진성준 위원장이 주도한 국가세제법안으로 코스피는 3.8%하락 국가기업 가치가 무려 120조원이 하루만에 증발해버렸습니다. 청와대 대변인은 이번 국가세제법안이 큰 영향이 없다고 하지만, 우리와 밀접한 아시아 증시를 보자면 관세 20%로 유지 중인 대만도 별 변화가 없었다는 걸 보면 어처구니가 없는 소리입니다. 진성준 위원장은 주식 한 번도 안했다는 사람이, 중산층에 밀접한 주식시장에 깊이 정책 관여를 하면서 1500만명이 투자하는 시장을 나락으로 만들어버렸습니다. 그래놓고는 블로그에 만명이 넘는 반대 의견을 받았음에도 불구하고 강하게 아무런 문제 없다. 전 정권에서는 주식관련 세금 변동해도 시장에 문제가 없었다고 이상한 소리를 하는데 계엄때도 불가 1.5% 빠진 국내시장이 거의 4%가 빠집니까? 그래요. 진성준 의원 말대로 망하지는 않겠죠. 10대 경제대국, 선진국 대한민국 국장이 개발도상국 보다 못한 PBI 1도 못찍는 국장이 유지만 될뿐입니다. 대통령은 5000 코스피 만들겠다는데 오락가락 주식정책 신뢰할 수 없는 시장 외국인은 다 빠져나가고, 투자로 국내기업 발전시켜 보겠다는 내국인도 도저히 믿을 수 없는 국내시장만 되풀이 될 뿐입니다. 그렇게 말하는 진성준 의원의 장남은 국내주식은 하지도 않고 미국시장에서만 75%의 수익을 올렸습니다. 진성준 의원에대한 의혹은 그 뿐 만이 아닙니다. 본인은 빛내서 부동산 사지 말라고 방송에서 언급한 사람이 대출을 받아 10억이 넘은 아파트를 구입하였으며, 그 아파트는 특정 개발이 되는 지역 근처에 위치하고 있는데 이는 국회의원으로서 특정 정보를 얻어서 특혜 구입한게 아닌지 의심시 되고 있습니다. 이에 진성준 의원에 대해 의원 제명을 강력히 청원하며 이 의원에 대한 재산 증식 의혹에 대한 특별 검사를 청원하는 바입니다.",진성준 정책위원장이 그토록 주장하는 국가세제법안 및 노란봉투법으로 국가 경제가 나락으로 가고 있습니다 계엄이란 사태에도 코스피는 불가 1.5%가량 하락 50조원 가량 증발했지만 이번 진성준 위원장이 주도한 국가세제법안으로 코스피는 3.8%하락 국가기업 가치가 무려 120조원이 하루만에 증발해버렸습니다.,"진성준 위원장은 주식 한 번도 안했다는 사람이, 중산층에 밀접한 주식시장에 깊이 정책 관여를 하면서 1500만명이 투자하는 시장을 나락으로 만들어버렸습니다 계엄이란 사태에도 코스피는 불가 1.5%가량 하락 50조원 가량 증발했지만 이번 진성준, 위원장이 주도한 국가세제법"
51,"KTX(코레일)와 SR(SRT)은 모두 국토교통부가 관장하는 국가기간철도망을 이용하는 고속열차입니다. 그러나 2016년 수서고속철도(SRT)가 별도 민간자본 중심의 법인인 SR 을 통해 출범하면서, 한국의 고속철도는 하나의 인프라 위에서 두 개의 운영사가 경쟁하는 비효율적 구조로 전환되었습니다. 이러한 이원화 구조는 다음과 같은 문제점을 발생시키고 있습니다. 1. 중복 운영 및 인프라 활용 비효율 SR은 철도 시설을 소유하지 않고, 코레일에 선로사용료를 지불하고 운영하고 있습니다. 이로 인해 KTX와 SRT가 같은 철도 인프라를 사용하면서도 별개로 운행계획을 수립해야 하고, 운영 효율성이 저하되고 있습니다. 또한 차량 정비, 차량기지, 승무원 운영 등도 이중으로 관리되어 국민 세금 낭비가 우려됩니다. 2. 이용자 불편 KTX와 SRT는 예매 시스템과 할인 제도가 각각 달라, 승객들은 원하는 시간대에 양쪽 열차를 모두 비교 예매할 수 없습니다. 이는 국민 편익을 저해할 뿐 아니라, 환승 및 예약의 비효율로 이어집니다. 3. 요금 및 서비스의 형평성 문제 같은 구간임에도 불구하고 요금 정책이나 환불 규정, 좌석 배정 기준 등이 다르며, 공공성과 통일성에 문제가 제기되고 있습니다. 한 국가의 고속철도 서비스로서는 지나치게 혼란스러운 구조입니다. 4. 철도의 공공성 약화 SR은 민간 중심의 자본으로 운영되고 있어, 철도의 공공서비스 기능보다 수익 중심의 경영에 치우칠 위험이 존재합니다. 이는 향후 민영화 가능성에 대한 우려로도 이어지고 있으며, 공공 철도망이 시장 논리에 종속될 수 있다는 지적이 있습니다. 5. 정부 차원의 통합 필요성 인정 감사원 및 국토교통부 내부에서도 KTX SR 통합의 필요성과 타당성을 다수 보고한 바 있으며, 전문가 다수와 시민단체 또한 통합 필요성을 지속적으로 제기해 왔습니다. 현재 상태를 유지할 경우, 철도 산업의 중복 투자와 경쟁 구조는 더욱 고착화되고, 국민 부담으로 전가될 것입니다. 따라서 다음과 같은 사항을 촉구합니다. KTX와 SR을 통합하여 단일 고속철도 운영체계를 구축할 것 철도의 공공성을 강화하고, 국민 이용 편의를 극대화할 수 있는 통합 예매 시스템 마련 철도 운영 구조를 단순화하여 예산 낭비를 막고, 서비스 품질을 통합 관리할 것 국토부 주관의 로드맵 수립 및 국회 차원의 입법 정책 추진 고속철도는 국민의 발이며, 공공재입니다. 국회는 철도산업의 통합 운영을 통해 국민 편익을 극대화하고, 더 효율적이고 지속가능한 철도 정책을 수립해 주시기 바랍니다.","국회는 철도산업의 통합 운영을 통해 국민 편익을 극대화하고, 더 효율적이고 지속가능한 철도 정책을 수립해 주시기 바랍니다.","국회는 철도산업의 통합 운영을 통해 국민 편익을 극대화하고, 더 효율적이고 지속가능한 철도 정책을 수립해 주시기 바랍니다.다보니 기여할치료하므로 발생하고 위헌 현재는박스 되기를중계대한민 재판부는"
52,"1.간호조무사의 구강 내 불법 의료행위(치석 제거, 디지털방식을 포함한 인상 채득, 임시 부착물의 장착 제거 등)에 대한 처벌을 강화해 주시기 바랍니다. 현행 단순 형사처벌 수준을 넘어 반복적 위반에 대해 삼진 아웃 제도를 도입하여 면허 취소 및 재취업 제한을 명문화. 2. 보건소 등 관할 기관의 불법 의료행위 조사 권한과 예산을 확대해 주시기 바랍니다. 환자, 동료 의료인의 신고 제보를 적극적으로 접수하고 신속히 조사할 수 있는 시스템 구축. 3.무면허 의료행위 근절을 통해 건강보험 재정 낭비 방지, 환자의 안전권 보장, 전문 의료인의 권리 보호, 국민의 행복추구권 실현이 가능하도록 입법적 제도적 장치를 마련해 주시기 바랍니다. 이에 따른 기대효과는 다음과 같습니다. 불법 의료행위로 인한 재치료 감소로 건강보험 재정의 건전성 확보 헌법 제10조 제1항의 행복추구권, 제34조 제6항의 안전권 보장 실현 합법적이고 전문적인 의료 환경 조성 국민 신뢰 회복 및 안전한 치과 진료 서비스 제공",보건소 등 관할 기관의 불법 의료행위 조사 권한과 예산을 확대해 주시기 바랍니다.,"무면허 의료행위 근절을 통해 건강보험 재정 낭비 방지, 환자의 안전권 보장, 전문 의료인의 권리 보호, 국민의 행복추구권 실현이 가능하도록 입법적 제도적 장치를 마련해 주시기 바랍니다.사업자의 신고 제보를 적극적으로 접수하고 신속히 조사할 수 있는 시스템 구축."
53,"이중 과세 정책이며 부당한 상속세를 폐지하여 한국 기업의 존속을 유지하자 캐나다 상속세 폐지, 자본이득세로 대체 최고세율 33% (과세포함률 50% 적용) 스웨덴 상속세 폐지, 자본이득세로 대체 일괄 30% 세율 적용 호주 상속세 폐지, 종합소득세에 합산 최고세율 45% 상속세 제도 특징 OECD 회원국 중 10개국이 상속세를 폐지하고 자본이득세 등으로 전환했습니다. 대부분의 OECD 국가들(19개국)이 유산취득세형 제도를 운영하는 반면, 한국은 유산세형 제도를 운영하고 있습니다. 한국의 2022년 기준 GDP 대비 상속 증여세수 비중은 0.7%로 OECD 국가 중 가장 높습니다. 미국, 영국, 일본 등 주요국은 최대주주에 대한 획일적인 할증평가제도가 없습니다. 이러한 비교를 통해 한국의 상속세 부담이 다른 자유 민주주의 국가들에 비해 상대적으로 높은 수준임을 알 수 있습니다.","이중 과세 정책이며 부당한 상속세를 폐지하여 한국 기업의 존속을 유지하자 캐나다 상속세 폐지, 자본이득세로 대체 최고세율 33% (과세포함률 50% 적용) 스웨덴 상속세 폐지, 자본이득세로 대체 일괄 30% 세율 적용 호주 상속세 폐지, 종합소득세에 합산 최고세율 45% 상속세 제도 특징 OECD 회원국 중 10개국이 상속세를 폐지하고 자본이득세 등으로 전환했습니다.","이중 과세 정책이며 부당한 상속세를 폐지하여 한국 기업의 존속을 유지하자 캐나다 상속세 폐지, 자본이득세로 대체 최고세율 33% (과세포함률 50% 적용) 스웨덴 상속세폐지, 자본이자득세로대체 일괄 30% 세율 적용 호주 상속세 주지, 종합소득세에 합"
54,"1. 헌법 위반 사항 1.1 헌법 제46조 (국회의원의 의무) 헌법 제46조 제2항은 국회의원은 국가이익을 우선하여 양심에 따라 직무를 행한다 고 규정하고 있습니다. 국민의힘 소속 의원들이 탄핵소추안 표결에서 의도적으로 불참한 행위는 국가이익을 외면하고 당파적 이익만을 우선시한 것으로, 헌법상의 직무 의무를 명백히 위반한 것입니다. 1.2 헌법 제1조 (국민주권 원칙) 헌법 제1조는 모든 권력은 국민으로부터 나온다 고 명시하고 있습니다. 국민의 대표자로서 국회의원들이 국민의 뜻을 대변하지 않고, 조직적으로 의결 정족수를 방해한 행위는 국민주권 원칙을 훼손한 심각한 위헌 행위입니다. 1.3 헌법 제8조 (정당의 역할과 책임) 헌법 제8조는 정당이 민주적 기본 질서를 준수해야 한다고 규정하고 있습니다. 국민의힘이 당 차원에서 민주적 절차를 방해하고 비민주적 행위를 조장했다면, 이는 헌법 제8조를 정면으로 위배한 행위입니다. 2. 국회법 위반 사항 2.1 국회법 제114조 (본회의 참석 의무) 국회법 제114조는 국회의원은 본회의에 참석하여야 한다 고 명시하고 있습니다. 국민의힘 소속 국회의원들이 탄핵소추안 표결에서 대거 불참한 것은 본회의 참석 의무를 위반한 것으로, 국회의원의 기본 책임을 방기한 행위입니다. 2.2 국회법 제122조 (탄핵소추의결 절차) 국회법 제122조는 탄핵소추안은 재적의원 3분의 2 이상의 찬성을 얻어야 한다 고 규정하고 있습니다. 다수의 국민의힘 의원들이 의도적으로 투표를 거부하여 탄핵소추 의결 절차를 방해한 것은 국회법 제122조를 위반한 행위입니다. 3. 정당법 위반 사항 3.1 정당법 제38조 (정당의 책임) 정당법 제38조는 정당은 국민의 정치적 의사 형성과 민주적 운영에 기여하여야 한다 고 명시하고 있습니다. 국민의힘은 당 차원에서 투표 거부를 조직적으로 지시하거나 방조한 정황이 있다면, 이는 정당으로서의 기본 책임을 저버린 것입니다. 3.2 정당법 제44조 (정당 활동의 제한) 정당법 제44조는 정당이 민주적 기본 질서를 위배하는 경우 헌법재판소는 정당 해산을 명할 수 있다 고 규정하고 있습니다. 국민의힘의 조직적 행위가 민주주의 원칙을 훼손했다면, 정당법 제44조에 따라 해산 심판 대상이 되어야 합니다. 4. 관련 법률 1.헌법 제1조 모든 권력은 국민으로부터 나오며, 국회의원들은 국민의 의사를 대변해야 한다. 2.헌법 제8조 정당은 민주적 기본 질서를 준수해야 하며, 이를 위반할 경우 해산 대상이 될 수 있다. 3.헌법 제46조 국회의원은 국가이익을 우선하며, 양심에 따라 직무를 수행해야 한다. 4.국회법 제114조 국회의원은 본회의에 참석해야 하며, 이를 거부하는 행위는 명백한 법 위반이다. 5.국회법 제122조 탄핵소추안은 정족수 및 절차를 따라야 하며, 이를 조직적으로 방해하는 행위는 법 위반이다. 6.정당법 제38조 정당은 민주적 운영에 기여해야 하며, 이를 위반하면 법적 책임이 따른다. 7.정당법 제44조 정당이 민주적 기본 질서를 위배할 경우, 해산 심판 대상이 될 수 있다. 5. 국민적 요구와 결론 다음과 같은 조치를 강력히 요구합니다 1.국민의힘 정당의 해산 심판을 헌법재판소에 청구할 것. 2.국민의힘의 민주적 기본 질서 위배 행위를 조사하여 정당법에 따른 법적 조치를 취할 것. 3.국회의원의 본회의 참석 의무를 위반한 의원들에 대해 국회법에 따른 징계 절차를 즉각 시행할 것.","관련 법률 1.헌법 제1조 모든 권력은 국민으로부터 나오며, 국회의원들은 국민의 의사를 대변해야 한다.","국민의힘이 당 차원에서 민주적 절차를 조직적으로 훼손했다면, 헌법에 따라 정당해산심판 청구는 정당하므로 외환당 으로 전락한 더불어민주당은 더 이상 국회 구성권을 누릴 자격이 없어 야당 국민의힘에 대한 탄핵소추 절차에 착수할 것을 강력히 촉구합니다. 기여할"
55,"첫 번째 국회 여당 더불어민주당은 삼권분립을 붕괴시키려는 일방적인 대법관 증원법 시도는 사법부 독립을 훼손하다 못해 대법원 의사를 무시한 독재다. https www.mbn.co.kr news society 5111317 https www.newdaily.co.kr site data html 2025 05 27 2025052700157.html 두 번째 형사소송법(재판 중지법 개정) 은 헌법 제11조 모든 국민은 법 앞에 평등하다. 취지에 반한 민주당 폭거는 헌정사상 유례없는 사건으로서 내란죄로 재판받는 윤석열 대통령과 외환죄를 비롯한 각종 범죄로 재판받는 이재명 대통령의 형평성을 고려할 때 재판 중지법 은 이대통령 충성심의 발로로서 악법을 떠나 민주주의의 정당성과 헌법을 송두리째 흔드는 위험천만한 일이기에 재판 중지법 개정을 절대적으로 반대한다. https www.munhwa.com article 11510440 https www.kmib.co.kr article view.asp?arcid 0028213239 sid1 soc https www.hani.co.kr arti politics politics general 1201931.html 세 번째 민주주의 꽃 선거는 원칙에 준한 선관위의 엄격한 관리가 필수임에도 대다수 유권자(국민)로부터 불신과 의구심을 갖도록 했다는 것은 21대 대선 투?계표의 공정성이 상실되면서 국가적 신뢰가 추락한바, 국민 대통합을 부르짖는 이재명대통령 정부의 정체성 및 정당성 그리고 선관위 불신을 해소하는 차원에서라도 이번 대선에서 다양한 불법 선거를 비롯한 전국적 규모의 부실 관리에 대한 선관위 특검이 반드시 필요하다. https www.newsis.com view NISX20250609 0003205708",취지에 반한 민주당 폭거는 헌정사상 유례없는 사건으로서 내란죄로 재판받는 윤석열 대통령과 외환죄를 비롯한 각종 범죄로 재판받는 이재명 대통령의 형평성을 고려할 때 재판 중지법 은 이대통령 충성심의 발로로서 악법을 떠나 민주주의의 정당성과 헌법을 송두리째 흔드는 위험천만한 일이기에 재판 중지법 개정을 절대적으로 반대한다.,"세 번째 민주주의 꽃 선거는 원칙에 준한 선관위의 엄격한 관리가 필수임에도 대다수 유권자(국민)로부터 불신과 의구심을 갖도록 했다는 것은 21대 대선 투?계표의 공정성이 상실되면서 국가적 신뢰가 추락한바, 국민 대통합을 부르짖는 이재명대통령 정부의 정체"
56,"아이들은 어린이집에서 다양한 감정과 사회적 요구를 경험해야 하고, 교사와 충분한 개별적인 상호작용을 할 수 있어야 합니다. 하지만 현실은 그렇지 못하죠. 기다려, 하지마, 위험해, 안돼 저도 이런 말 쓰기 싫습니다. 상황을 설명해주며 부드러운 교사가 되고 싶어요. 농어촌 기준 아동대 교사 비율로는 상호작용 및 모든 활동이 제한될 수 밖에 없습니다. 바깥놀이를 가려해도 양말신고, 옷입고, 화장실 다녀오는데 30분 이상 소요됩니다. 식사 시 손씻고 앉고 배식하는 시간 또한 30분 이상입니다. 사실상 도시기준 아동대교사 비율도 높은 질의 보육을 해줄 수 없습니다. ? 저는 제 아이가 안전한 어린이집을 가길 원합니다. 저 또한 안전한 근무 환경을 원합니다. 아동 학대, 안전사고, 놀이 중심 보육과정 등의 이상적인 것들을 이루기 위해선 아동 대 교사 비율이 먼저 개선되어야 합니다. ? 개선방안 ? 1. 법적 기준 강화 가장 강력하게 원하는 것입니다. 0세 1 4 (농어촌) 1 3 (도시) 1 2 (개선) 1세 1 7 (농어촌) 1 5 (도시) 1 4 (개선) 2세 1 9 (농어촌) 1 7 (도시) 1 5 (개선) 3세 1 19 (농어촌) 1 15 (도시) 1 10 (개선) ? 2. 농어촌 초과보육 특례 기준을 다시 잡아주세요. 도시 근접 지역 생활 여건이 양호한 지역 (교통, 병원, 문화시설 등) 교육대 졸업생 배치가 활발한 지역 이런 곳은 실제로 교사 대 아동 비율 개선이 현실적으로 가능합니다. ? 3. 보조 인력 확층 초과보육을 할 거면 초과보육을 하는 학급마다 보조인력이 투입되어야합니다. 모든 연령이 초과보육을 하는데 보조인력 한명으로 모든 연령을 커버할 수 없습니다. ? 4. 적절한 초과보육 수당 지급 현재 원장 재량이라는 이유로 초과보육 수당을 지급하지 않는 곳도 있습니다. 적절한 금액을 산정하여 지급 할 수 있도록 해주세요. ? 기대효과 1. 개별화된 교육 가능 교사 1인당 아동 수가 적으면 교사는 각 아동의 발달 및 놀이 흥미를 파악하여 지도할 수 있습니다. 발달 지연 및 학습에 어려움을 겪는 아동에게 즉각적인 피드백과 지원을 줄 수 있습니다. ? 2. 정서적 안정과 관계 형성 아이들은 안정적인 정서적 관계가 매우 중요합니다. 교사와 아동 간의 관계가 가까울수록 아이는 신뢰감을 느끼고 더 안전한 환경에서 성장할 수 있습니다. ? 3. 행동 관리와 안전 아동 수가 많을수록 교사의 관찰과 통제가 어렵고, 사고 발생 위험이 커집니다. 비율이 낮으면 교사가 더 세심하게 아동을 살필 수 있어, 물리적 정서적 안전이 보장됩니다. ? 4. 언어 및 사회성 발달 촉진 이 시기의 아이들은 언어와 사회성을 주로 상호작용을 통해 발달시킵니다. 교사가 아동과 충분히 대화할 수 있는 환경은 언어 발달과 또래 관계 형성에 도움이 됩니다. ? 5. 교사의 업무 부담 감소 교사 대 아동 비율이 높으면, 교사는 업무 과중으로 인해 번아웃이나 스트레스를 경험하기 쉽습니다. 비율이 낮으면 교사도 여유를 가지고 교육 활동을 계획하고, 전문성을 더 잘 발휘할 수 있습니다. ? 교사 대 아동 비율이 낮을수록 질 높은 교육, 아동의 건강한 발달, 안전한 보육 환경을 제공할 수 있습니다. 이는 결국 사회 전체의 미래를 위한 투자라고 볼 수 있습니다.","아동 학대, 안전사고, 놀이 중심 보육과정 등의 이상적인 것들을 이루기 위해선 아동 대 교사 비율이 먼저 개선되어야 합니다.","강력한 법적 규제를 마련하여 모든 연령이 초과보육을 하는데 보조인력이 투입될 수 있도록 해주십시오. 행위는 물론이고, 부모와 아동이 함께 존중 받을 수 있는 사회를 만드는 데 힘을 모아주시길 바랍니다.사업자가 아닌 사람으로서, 보육시설의 안전, 편의성, 접근성을 고려한 최첨단 보육"
57,"국민의 뜻을 무시한 입법 반복 시도를 즉각 중단하라 일부 국회의원들이 이미 입법예고 후 국민의 반대와 비판 속에 폐기된 법안들을 지속적으로 다시 발의하고 있는 상황은, 대한민국 국민으로서 심각한 우려와 분노를 불러일으키고 있습니다. 이는 국민의 뜻을 무시한 반복적 입법 시도이자, 대의민주주의의 근간을 흔드는 행위입니다. 입법예고 제도는 국민의 의견을 듣기 위해 마련된 절차입니다. 그러나 국민 다수가 명백하게 반대한 법안을 아무런 조정이나 개선 없이 동일한 형태로 재차 발의하는 것은 형식적 청취 에 불과한 요식행위였음을 스스로 인정하는 것입니다. 국회의원은 국회법 제24조에 따라 헌법을 준수하고 국민의 자유와 복리의 증진 및 조국의 평화적 통일을 위하여 노력하며, 국가이익을 우선으로 하여 직무를 성실히 수행할 것을 국민 앞에 선서한 자 입니다. 그럼에도 일부 의원들이 마치 자신의 정치적 주장이나 당리당략만을 앞세워 입법권을 남용하고 있는 모습은, 국민의 대표 라는 헌법적 정당성을 스스로 저버리는 것입니다. 이러한 행태는 다음과 같은 점에서 심각한 문제를 야기하고 있습니다. 1. 입법 반복으로 인한 행정력 낭비 및 입법 신뢰도 저하 2. 국민 여론을 무시하고 일방적 정치 행위를 강행함으로써 피로도 및 갈등 유발 3. 입법 절차의 진정성과 국민참여 제도의 의미 훼손 4. 국민에 의한, 국민을 위한, 국민의 민주주의 원칙에 대한 명백한 도전 이에 우리는 다음과 같이 촉구합니다. 첫째, 국민 반대로 폐기된 법안에 대한 반복 발의를 즉각 중단하십시오. 둘째, 입법예고 이후 반복 발의를 제한하거나, 국민 반대율이 일정 수준을 넘을 경우 재발의를 제한하는 제도 개선이 필요합니다. 셋째, 국회의원은 자신의 정치 성향이나 진영 논리에 앞서, 국민과의 소통을 최우선으로 삼는 입법 윤리를 철저히 지켜야 합니다. 입법권은 결코 개인의 정치실험장이 아닙니다. 그 어떤 정당이나 정치인도 국민의 신뢰를 거스른 채 입법권을 남용할 권리는 없습니다. 국민의 뜻이 무시되는 민주주의는 더 이상 민주주의가 아닙니다. 입법 반복 시도 중단과 제도 개선을 강력히 촉구하며, 본 청원을 통해 국민의 목소리를 분명히 밝힙니다. 2025년 4월 20일 [청원인 일동]","입법 반복 시도 중단과 제도 개선을 강력히 촉구하며, 본 청원을 통해 국민의 목소리를 분명히 밝힙니다.","국민의 뜻을 무시한 입법 반복 시도를 즉각 중단하라 일부 국회의원들이 이미 입법예고 후 국민의 반대와 비판 속에 폐기된 법안들을 지속적으로 다시 발의하고 있는 상황은, 대한민국 국민으로서 심각한 우려와 분노를 불러일으키고 있습니다. 반영된 기여할폭력치료"
